{
  "run_id": "RUN-20260527-001",
  "created_at": "2026-05-27T13:00:00Z",
  "task_description": "Add fallback validation to ingestion config path",
  "project_id": "proj-ingestion-hardening",
  "repo_id": "repo-toy-python-service",
  "task_scope": "ingestion-pipeline",
  "initiated_by": "demo-user",
  "repo": {
    "name": "toy-python-service",
    "branch": "main",
    "base_commit": "abc1234"
  },
  "models": {
    "claude_orchestrator": "claude-code-v4.7",
    "codex_validator": "codex-v1"
  },
  "prompt_versions": {
    "orchestrator": "orchestrator-v0.1.0"
  },
  "prompt_hashes": {
    "orchestrator": "sha256:aaaaaaaaaaaaaaaaaaaaaaaaaaaaaaaaaaaaaaaaaaaaaaaaaaaaaaaaaaaaaaaa"
  },
  "guardrails": {
    "version": "2026-05-20",
    "source_path": "guardrails/"
  },
  "mode": "standard",
  "artifact_root": "runs/RUN-20260527-001"
}
